,微博正文,点赞数,转发数,评论数,附图,附链接,清洗正文,明星,TAG,正文
0,————这是一条顺顺利利的置顶————内:唯肖战韩:唯infinite一只小透明阳光信用764此条可互动·可聊天·可勾搭不要来回关/取/关互相伤耗有问题私信或者这条下面说不要搂我！不要搂我！不要搂我！谢谢！日常Pb周边开箱存档快乐开箱开箱http://t.cn/A6y1deWP自证http://t.cn/A6tjBwQL[不定期更新][组图共9张]原图,48,2,25,"<re.Match object; span=(168, 177), match='[组图共9张]原图'>","['http://t.cn/A6y1deWP', 'http://t.cn/A6tjBwQL']",————这是一条顺顺利利的置顶————内:唯肖战韩:唯infinite一只小透明阳光信用764此条可互动·可聊天·可勾搭不要来回关/取/关互相伤耗有问题私信或者这条下面说不要搂我！不要搂我！不要搂我！谢谢！日常Pb周边开箱存档快乐开箱开箱自证[不定期更新],[],[],————这是一条顺顺利利的置顶————内:唯肖战韩:唯infinite一只小透明阳光信用764此条可互动·可聊天·可勾搭不要来回关/取/关互相伤耗有问题私信或者这条下面说不要搂我！不要搂我！不要搂我！谢谢！日常Pb周边开箱存档快乐开箱开箱自证[不定期更新]
1,风水轮流转，往死里转！[组图共9张]原图,1,0,0,"<re.Match object; span=(11, 20), match='[组图共9张]原图'>",[],风水轮流转，往死里转！,[],[],风水轮流转，往死里转！
5,早安带给我快乐的人一定要加倍快乐！[组图共9张]原图,7,0,6,"<re.Match object; span=(17, 26), match='[组图共9张]原图'>",[],早安带给我快乐的人一定要加倍快乐！,[],[],早安带给我快乐的人一定要加倍快乐！
6,GN.肖战唐三[组图共3张]原图,6,0,2,"<re.Match object; span=(7, 16), match='[组图共3张]原图'>",[],GN.肖战唐三,[],[],GN.肖战唐三
8,肖战的签名照打卡有~谢谢蜡笔@蜡笔欣崽原图,4,0,5,"<re.Match object; span=(19, 21), match='原图'>",[],肖战的签名照打卡有~谢谢蜡笔@蜡笔欣崽,[],[],肖战的签名照打卡有~谢谢蜡笔@蜡笔欣崽
9,陌森代言人肖战的立牌打卡有！谢谢一一@Yumville·[组图共3张]原图,12,0,4,"<re.Match object; span=(28, 37), match='[组图共3张]原图'>",[],陌森代言人肖战的立牌打卡有！谢谢一一@Yumville·,[],[],陌森代言人肖战的立牌打卡有！谢谢一一@Yumville·
10,#百闻不如一见是肖战啊[超话]##肖战#你迎风而来宛如千树花开#肖战平安喜乐#@X玖少年团肖战DAYTOY#百闻不如一见是肖战#[组图共3张]原图,3,1,33,"<re.Match object; span=(64, 73), match='[组图共3张]原图'>",[],你迎风而来宛如千树花开@X玖少年团肖战DAYTOY,['@X玖少年团肖战DAYTOY'],"['百闻不如一见是肖战啊[超话]', '肖战', '肖战平安喜乐', '百闻不如一见是肖战']",你迎风而来宛如千树花开@X玖少年团肖战DAYTOY
11,不会说话就别乱跑…专注自家，谨言慎行。安心炖[组图共9张]原图,7,0,0,"<re.Match object; span=(22, 31), match='[组图共9张]原图'>",[],不会说话就别乱跑…专注自家，谨言慎行。安心炖,[],[],不会说话就别乱跑…专注自家，谨言慎行。安心炖
14,早安生活就是这样别人只看结果过程自己独撑。[组图共9张]原图,4,0,0,"<re.Match object; span=(21, 30), match='[组图共9张]原图'>",[],早安生活就是这样别人只看结果过程自己独撑。,[],[],早安生活就是这样别人只看结果过程自己独撑。
15,GN.帅气的肖战唐三[组图共4张]原图,6,0,1,"<re.Match object; span=(10, 19), match='[组图共4张]原图'>",[],GN.帅气的肖战唐三,[],[],GN.帅气的肖战唐三
17,用开小灶的水煮牛肉的汤泡饭~好好吃饭[组图共9张]原图,3,0,0,"<re.Match object; span=(18, 27), match='[组图共9张]原图'>",[],用开小灶的水煮牛肉的汤泡饭~好好吃饭,[],[],用开小灶的水煮牛肉的汤泡饭~好好吃饭
20,"早安朋友圈背景图|无水印壁纸这个世界脏了，干净就成了一种""罪""。[组图共9张]原图",8,0,2,"<re.Match object; span=(32, 41), match='[组图共9张]原图'>",[],"早安朋友圈背景图|无水印壁纸这个世界脏了，干净就成了一种""罪""。",[],[],"早安朋友圈背景图|无水印壁纸这个世界脏了，干净就成了一种""罪""。"
22,GN·唐三好帅[吃瓜吃到自己头上的唐三][组图共3张]原图,5,0,0,"<re.Match object; span=(20, 29), match='[组图共3张]原图'>",[],GN·唐三好帅[吃瓜吃到自己头上的唐三],[],[],GN·唐三好帅[吃瓜吃到自己头上的唐三]
25,前十名肖哥一个人占了仨还是1.2.6.就是这么厉害()[组图共9张]原图,6,0,2,"<re.Match object; span=(27, 36), match='[组图共9张]原图'>",[],前十名肖哥一个人占了仨还是1.2.6.就是这么厉害(),[],[],前十名肖哥一个人占了仨还是1.2.6.就是这么厉害()
26,我终于也截到开屏啦原图,6,1,0,"<re.Match object; span=(9, 11), match='原图'>",[],我终于也截到开屏啦,[],[],我终于也截到开屏啦
29,早安总觉得开心来之不易可难过却毫不费心[组图共9张]原图,3,0,6,"<re.Match object; span=(19, 28), match='[组图共9张]原图'>",[],早安总觉得开心来之不易可难过却毫不费心,[],[],早安总觉得开心来之不易可难过却毫不费心
32,tt说想看万有开箱，拖延症晚期刚好不容易去录了！结果录了快半个小时…去导入剪辑才发现不小心开了慢动作录像还全程无聚焦！快进起来糊成狗原图,1,0,2,"<re.Match object; span=(66, 68), match='原图'>",[],tt说想看万有开箱，拖延症晚期刚好不容易去录了！结果录了快半个小时…去导入剪辑才发现不小心开了慢动作录像还全程无聚焦！快进起来糊成狗,[],[],tt说想看万有开箱，拖延症晚期刚好不容易去录了！结果录了快半个小时…去导入剪辑才发现不小心开了慢动作录像还全程无聚焦！快进起来糊成狗
34,女神们~节日快乐来接收男神送给你们的祝福原图,11,1,1,"<re.Match object; span=(20, 22), match='原图'>",[],女神们~节日快乐来接收男神送给你们的祝福,[],[],女神们~节日快乐来接收男神送给你们的祝福
37,早安虽然很累，但是请相信一切都会好。[组图共9张]原图,3,0,14,"<re.Match object; span=(18, 27), match='[组图共9张]原图'>",[],早安虽然很累，但是请相信一切都会好。,[],[],早安虽然很累，但是请相信一切都会好。
39,"一个小目标:不""住""在微博·22:05以后入睡原图",3,0,2,"<re.Match object; span=(23, 25), match='原图'>",[],"一个小目标:不""住""在微博·22:05以后入睡",[],[],"一个小目标:不""住""在微博·22:05以后入睡"
45,自证[组图共11张]原图,13,0,3,"<re.Match object; span=(2, 12), match='[组图共11张]原图'>",[],自证,[],[],自证
48,我愿在暴风雨中艰苦的斗争中锻炼自己不愿在平平静静的日子里度过自己的一生[组图共9张]原图,2,0,1,"<re.Match object; span=(35, 44), match='[组图共9张]原图'>",[],我愿在暴风雨中艰苦的斗争中锻炼自己不愿在平平静静的日子里度过自己的一生,[],[],我愿在暴风雨中艰苦的斗争中锻炼自己不愿在平平静静的日子里度过自己的一生
49,"#我们坐在高高的虾壳上听老虾讲过去的故事[超话]#姐妹们！""过年好""！过年了过年了原图",11,0,1,"<re.Match object; span=(41, 43), match='原图'>",[],"姐妹们！""过年好""！过年了过年了",[],['我们坐在高高的虾壳上听老虾讲过去的故事[超话]'],"姐妹们！""过年好""！过年了过年了"
50,"今晚的节目真的太满足了""冬梦之约""真的圆了好多""梦""运动肖战，念白肖战，歌手肖战[组图共9张]原图",89,2,1,"<re.Match object; span=(40, 49), match='[组图共9张]原图'>",[],"今晚的节目真的太满足了""冬梦之约""真的圆了好多""梦""运动肖战，念白肖战，歌手肖战",[],[],"今晚的节目真的太满足了""冬梦之约""真的圆了好多""梦""运动肖战，念白肖战，歌手肖战"
52,来啦！哥哥的念白也好好听#肖战加盟冬梦之约#[组图共3张]原图,2,0,0,"<re.Match object; span=(22, 31), match='[组图共3张]原图'>",[],来啦！哥哥的念白也好好听,[],['肖战加盟冬梦之约'],来啦！哥哥的念白也好好听
53,在给自己买墨镜的同时也没忘给弟弟买个小礼物！我可真是个贴心的好姐姐！希望他可以喜欢原图,4,0,7,"<re.Match object; span=(41, 43), match='原图'>",[],在给自己买墨镜的同时也没忘给弟弟买个小礼物！我可真是个贴心的好姐姐！希望他可以喜欢,[],[],在给自己买墨镜的同时也没忘给弟弟买个小礼物！我可真是个贴心的好姐姐！希望他可以喜欢
54,#肖战最好的你[超话]#今天也是被楼哭了的一天[单身狗]求好多好多好多兔兔！谢谢大家原图,4,0,60,"<re.Match object; span=(42, 44), match='原图'>",[],今天也是被楼哭了的一天[单身狗]求好多好多好多兔兔！谢谢大家,[],['肖战最好的你[超话]'],今天也是被楼哭了的一天[单身狗]求好多好多好多兔兔！谢谢大家
55,"不管了反正我的一首好运来已经""放""起来！支持肖战代言#肖战陌森眼镜品牌代言人#原图",14,0,1,"<re.Match object; span=(39, 41), match='原图'>",[],"不管了反正我的一首好运来已经""放""起来！支持肖战代言",[],['肖战陌森眼镜品牌代言人'],"不管了反正我的一首好运来已经""放""起来！支持肖战代言"
62,早安肖战健健康康，顺顺利利！晚上见等风来吹动涟漪等花丛来拨动星光等你来[组图共9张]原图,0,0,0,"<re.Match object; span=(35, 44), match='[组图共9张]原图'>",[],早安肖战健健康康，顺顺利利！晚上见等风来吹动涟漪等花丛来拨动星光等你来,[],[],早安肖战健健康康，顺顺利利！晚上见等风来吹动涟漪等花丛来拨动星光等你来
65,冰球运动推广大使-肖战太正了！原图,7,0,3,"<re.Match object; span=(15, 17), match='原图'>",[],冰球运动推广大使-肖战太正了！,[],[],冰球运动推广大使-肖战太正了！
66,好运来[组图共9张]原图,2,0,0,"<re.Match object; span=(3, 12), match='[组图共9张]原图'>",[],好运来,[],[],好运来
67,首页好多涨分的！还都涨了二三十分！为什么我依旧一动不动！涨一分也好啊[组图共9张]原图,1,0,7,"<re.Match object; span=(34, 43), match='[组图共9张]原图'>",[],首页好多涨分的！还都涨了二三十分！为什么我依旧一动不动！涨一分也好啊,[],[],首页好多涨分的！还都涨了二三十分！为什么我依旧一动不动！涨一分也好啊
70,"早安朋友圈背景图|黑白INS风无水印壁纸""站在痛苦之外规劝受苦的人是件很容易的事。""[组图共9张]原图",6,0,0,"<re.Match object; span=(42, 51), match='[组图共9张]原图'>",[],"早安朋友圈背景图|黑白INS风无水印壁纸""站在痛苦之外规劝受苦的人是件很容易的事。""",[],[],"早安朋友圈背景图|黑白INS风无水印壁纸""站在痛苦之外规劝受苦的人是件很容易的事。"""
71,最后一次看时间是23:51…接着就睡过去了！刚突然惊醒一看时间觉得完了！赶紧打开好歹抢个立牌原图,2,0,1,"<re.Match object; span=(46, 48), match='原图'>",[],最后一次看时间是23:51…接着就睡过去了！刚突然惊醒一看时间觉得完了！赶紧打开好歹抢个立牌,[],[],最后一次看时间是23:51…接着就睡过去了！刚突然惊醒一看时间觉得完了！赶紧打开好歹抢个立牌
73,"欢迎收看""斗罗畜牧业"":该不该拉…[组图共3张]原图",4,0,0,"<re.Match object; span=(17, 26), match='[组图共3张]原图'>",[],"欢迎收看""斗罗畜牧业"":该不该拉…",[],[],"欢迎收看""斗罗畜牧业"":该不该拉…"
74,《斗罗大陆》[组图共3张]原图,2,0,0,"<re.Match object; span=(6, 15), match='[组图共3张]原图'>",[],《斗罗大陆》,[],[],《斗罗大陆》
75,肖战健健康康顺顺利利平安喜乐@X玖少年团肖战DAYTOY晚安我在。[组图共9张]原图,9,0,9,"<re.Match object; span=(33, 42), match='[组图共9张]原图'>",[],肖战健健康康顺顺利利平安喜乐@X玖少年团肖战DAYTOY晚安我在。,['@X玖少年团肖战DAYTOY'],[],肖战健健康康顺顺利利平安喜乐@X玖少年团肖战DAYTOY晚安我在。
77,"好好吃饭,好好生活,好好爱自己和家人,好好爱他[组图共9张]原图",1,0,1,"<re.Match object; span=(23, 32), match='[组图共9张]原图'>",[],"好好吃饭,好好生活,好好爱自己和家人,好好爱他",[],[],"好好吃饭,好好生活,好好爱自己和家人,好好爱他"
79,想念原图,3,0,0,"<re.Match object; span=(2, 4), match='原图'>",[],想念,[],[],想念
82,就是想涨点社会关系社会关系一直没动过[组图共9张]原图,2,0,0,"<re.Match object; span=(18, 27), match='[组图共9张]原图'>",[],就是想涨点社会关系社会关系一直没动过,[],[],就是想涨点社会关系社会关系一直没动过
84,早安朋友圈背景图|简约INS风无水印壁纸不要只从别人那里听说ta…也请听听ta说的[组图共9张]原图,3,0,6,"<re.Match object; span=(41, 50), match='[组图共9张]原图'>",[],早安朋友圈背景图|简约INS风无水印壁纸不要只从别人那里听说ta…也请听听ta说的,[],[],早安朋友圈背景图|简约INS风无水印壁纸不要只从别人那里听说ta…也请听听ta说的
88,早安|朋友圈背景图|治愈系无水印壁纸[组图共9张]原图,8,0,1,"<re.Match object; span=(18, 27), match='[组图共9张]原图'>",[],早安|朋友圈背景图|治愈系无水印壁纸,[],[],早安|朋友圈背景图|治愈系无水印壁纸
91,#阳光信用[超话]#阳光信用每月初1-3号涨信用[求饶]一起互动涨涨吧注:本人肖战粉·请看清楚属性后·再蹭带#阳光信用#tag转赞评这条wb阳光信用立涨。原图,186,338,354,"<re.Match object; span=(77, 79), match='原图'>",[],阳光信用每月初1-3号涨信用[求饶]一起互动涨涨吧注:本人肖战粉·请看清楚属性后·再蹭带tag转赞评这条wb阳光信用立涨。,[],"['阳光信用[超话]', '阳光信用']",阳光信用每月初1-3号涨信用[求饶]一起互动涨涨吧注:本人肖战粉·请看清楚属性后·再蹭带tag转赞评这条wb阳光信用立涨。
93,555终于中奖了！@开小灶官方微博谢谢灶灶子原图,10,0,7,"<re.Match object; span=(22, 24), match='原图'>",[],555终于中奖了！@开小灶官方微博谢谢灶灶子,[],[],555终于中奖了！@开小灶官方微博谢谢灶灶子
95,肖战在片场好请客#肖战#经常请客的战总好帅[组图共3张]原图,6,0,2,"<re.Match object; span=(21, 30), match='[组图共3张]原图'>",[],肖战在片场好请客经常请客的战总好帅,[],['肖战'],肖战在片场好请客经常请客的战总好帅
96,"#肖战[超话]#@X玖少年团肖战DAYTOY三月你好愿你光芒万丈驭风扶摇直上愿你以后的每一天都健健康康,顺顺利利[心]#肖战平安喜乐#xz#向全世界安利肖战#[组图共12张]原图",40,6,156,"<re.Match object; span=(79, 89), match='[组图共12张]原图'>",[],"@X玖少年团肖战DAYTOY三月你好愿你光芒万丈驭风扶摇直上愿你以后的每一天都健健康康,顺顺利利[心]xz",['@X玖少年团肖战DAYTOY'],"['肖战[超话]', '肖战平安喜乐', '向全世界安利肖战']","@X玖少年团肖战DAYTOY三月你好愿你光芒万丈驭风扶摇直上愿你以后的每一天都健健康康,顺顺利利[心]xz"
98,早安！我独自走过苍苍茫茫与你同行才有了光[组图共9张]原图,5,2,2,"<re.Match object; span=(20, 29), match='[组图共9张]原图'>",[],早安！我独自走过苍苍茫茫与你同行才有了光,[],[],早安！我独自走过苍苍茫茫与你同行才有了光
99,再见二月|朋友圈背景图|高清治愈系壁纸坦坦荡荡利利落落地结束所有不值得的关系[组图共9张]原图,5,0,0,"<re.Match object; span=(38, 47), match='[组图共9张]原图'>",[],再见二月|朋友圈背景图|高清治愈系壁纸坦坦荡荡利利落落地结束所有不值得的关系,[],[],再见二月|朋友圈背景图|高清治愈系壁纸坦坦荡荡利利落落地结束所有不值得的关系
103,"落幕即被夹嘴我今天只能到此结束了…估计又要被关8个小时了…明天""见""吧[组图共3张]原图",4,0,17,"<re.Match object; span=(35, 44), match='[组图共3张]原图'>",[],"落幕即被夹嘴我今天只能到此结束了…估计又要被关8个小时了…明天""见""吧",[],[],"落幕即被夹嘴我今天只能到此结束了…估计又要被关8个小时了…明天""见""吧"
104,"我不知道哪里来的新""自信""，在韩红老师说要读一下一起做公益的艺人名单时候…我就觉得一定有你今天是二月的最后一天。一切意不平都止于二月吧！明天开始就是三月了，一切都是新的开始！未来不管是演艺之路还是公益之路都有我们和你一起同行！不忘初心，不离不弃，向阳而生！""人总要仰望点什么""我会继续""仰望""着你！向着你努力前行！保持善良，努力成为更好的自己！肖先生有你真好！@X玖少年团肖战DAYTOY原图",6,0,2,"<re.Match object; span=(194, 196), match='原图'>",[],"我不知道哪里来的新""自信""，在韩红老师说要读一下一起做公益的艺人名单时候…我就觉得一定有你今天是二月的最后一天。一切意不平都止于二月吧！明天开始就是三月了，一切都是新的开始！未来不管是演艺之路还是公益之路都有我们和你一起同行！不忘初心，不离不弃，向阳而生！""人总要仰望点什么""我会继续""仰望""着你！向着你努力前行！保持善良，努力成为更好的自己！肖先生有你真好！@X玖少年团肖战DAYTOY",['@X玖少年团肖战DAYTOY'],[],"我不知道哪里来的新""自信""，在韩红老师说要读一下一起做公益的艺人名单时候…我就觉得一定有你今天是二月的最后一天。一切意不平都止于二月吧！明天开始就是三月了，一切都是新的开始！未来不管是演艺之路还是公益之路都有我们和你一起同行！不忘初心，不离不弃，向阳而生！""人总要仰望点什么""我会继续""仰望""着你！向着你努力前行！保持善良，努力成为更好的自己！肖先生有你真好！@X玖少年团肖战DAYTOY"
107,一身正气@X玖少年团肖战DAYTOY原图,8,2,1,"<re.Match object; span=(18, 20), match='原图'>",[],一身正气@X玖少年团肖战DAYTOY,['@X玖少年团肖战DAYTOY'],[],一身正气@X玖少年团肖战DAYTOY
108,#电视剧余生请多指教[超话]#呜呜呜呜呜！是顾魏和林之校啊啊啊啊啊啊！余生请多指教快点来吧顾顾和校校太配了！#余生请多指教#·#肖战顾魏#·#肖战余生请多指教#原图,49,1,9,"<re.Match object; span=(80, 82), match='原图'>",[],呜呜呜呜呜！是顾魏和林之校啊啊啊啊啊啊！余生请多指教快点来吧顾顾和校校太配了！··,[],"['电视剧余生请多指教[超话]', '余生请多指教', '肖战顾魏', '肖战余生请多指教']",呜呜呜呜呜！是顾魏和林之校啊啊啊啊啊啊！余生请多指教快点来吧顾顾和校校太配了！··
110,#肖战红毯#肖战红毯#肖战打招呼像机器人#这个男人是怎么做到又帅又这么可爱的！帅哭了[组图共4张]原图,1,0,0,"<re.Match object; span=(42, 51), match='[组图共4张]原图'>",[],肖战红毯这个男人是怎么做到又帅又这么可爱的！帅哭了,[],"['肖战红毯', '肖战打招呼像机器人']",肖战红毯这个男人是怎么做到又帅又这么可爱的！帅哭了
112,肖战微博之夜也太帅了#肖战微博之夜#原图,12,0,2,"<re.Match object; span=(18, 20), match='原图'>",[],肖战微博之夜也太帅了,[],['肖战微博之夜'],肖战微博之夜也太帅了
115,来呀~来呀~一起来呀#肖战微博之夜#肖战微博之夜#微博之夜肖战#微博之夜肖战#肖战微博之夜king#肖战微博之夜king健健康康顺顺利利@X玖少年团肖战DAYTOY原图,2,2,6,"<re.Match object; span=(82, 84), match='原图'>",[],来呀~来呀~一起来呀肖战微博之夜微博之夜肖战肖战微博之夜king健健康康顺顺利利@X玖少年团肖战DAYTOY,['@X玖少年团肖战DAYTOY'],"['肖战微博之夜', '微博之夜肖战', '肖战微博之夜king']",来呀~来呀~一起来呀肖战微博之夜微博之夜肖战肖战微博之夜king健健康康顺顺利利@X玖少年团肖战DAYTOY
117,一颗心扑通扑通的狂跳肖战微博之夜不知道晚上能见到怎样的你#肖战微博之夜#[组图共12张]原图,8,1,1,"<re.Match object; span=(36, 46), match='[组图共12张]原图'>",[],一颗心扑通扑通的狂跳肖战微博之夜不知道晚上能见到怎样的你,[],['肖战微博之夜'],一颗心扑通扑通的狂跳肖战微博之夜不知道晚上能见到怎样的你
119,#肖战最好的你[超话]#周末愉快[兔子]求好多好多兔兔和最新的安利图！想要最新的:告诉我产出原博我去存也行~谢谢原图,10,0,87,"<re.Match object; span=(56, 58), match='原图'>",[],周末愉快[兔子]求好多好多兔兔和最新的安利图！想要最新的:告诉我产出原博我去存也行~谢谢,[],['肖战最好的你[超话]'],周末愉快[兔子]求好多好多兔兔和最新的安利图！想要最新的:告诉我产出原博我去存也行~谢谢
122,早安朋友圈背景图|高清头像壁纸[组图共9张]原图,1,1,1,"<re.Match object; span=(15, 24), match='[组图共9张]原图'>",[],早安朋友圈背景图|高清头像壁纸,[],[],早安朋友圈背景图|高清头像壁纸
123,仰无愧于天俯无愧于地行无愧于人止无愧于心[组图共9张]原图,7,0,0,"<re.Match object; span=(20, 29), match='[组图共9张]原图'>",[],仰无愧于天俯无愧于地行无愧于人止无愧于心,[],[],仰无愧于天俯无愧于地行无愧于人止无愧于心
124,#斗罗大陆登陆央八晚间经典剧场#原图,2,0,0,"<re.Match object; span=(16, 18), match='原图'>",[],,[],['斗罗大陆登陆央八晚间经典剧场'],
125,晚安肖先生@X玖少年团肖战DAYTOY原图,1,0,0,"<re.Match object; span=(19, 21), match='原图'>",[],晚安肖先生@X玖少年团肖战DAYTOY,['@X玖少年团肖战DAYTOY'],[],晚安肖先生@X玖少年团肖战DAYTOY
126,#肖战最好的你[超话]#求好多好多兔兔！谢谢大家[给你小心心]期待肖战余生请多指教期待肖战顾魏肖战好帅肖战超帅我觉得肖战非常帅理智支持肖战代言理智支持肖战影视综艺原图,22,1,94,"<re.Match object; span=(81, 83), match='原图'>",[],求好多好多兔兔！谢谢大家[给你小心心]期待肖战余生请多指教期待肖战顾魏肖战好帅肖战超帅我觉得肖战非常帅理智支持肖战代言理智支持肖战影视综艺,[],['肖战最好的你[超话]'],求好多好多兔兔！谢谢大家[给你小心心]期待肖战余生请多指教期待肖战顾魏肖战好帅肖战超帅我觉得肖战非常帅理智支持肖战代言理智支持肖战影视综艺
128,人类的悲喜并不相通。也没有所谓的百分百的感同身受。开个树洞，评论会精选，可以说点想说的原图,9,0,5,"<re.Match object; span=(43, 45), match='原图'>",[],人类的悲喜并不相通。也没有所谓的百分百的感同身受。开个树洞，评论会精选，可以说点想说的,[],[],人类的悲喜并不相通。也没有所谓的百分百的感同身受。开个树洞，评论会精选，可以说点想说的
129,#肖战发长文#肖战发长文以后会跟你一起继续律己，会过好自己的生活。继续保持理智和纯粹好好努力，成更好的自己！凡此过往，皆为序章。别回头，一起向阳而生！原图,16,0,1,"<re.Match object; span=(75, 77), match='原图'>",[],肖战发长文以后会跟你一起继续律己，会过好自己的生活。继续保持理智和纯粹好好努力，成更好的自己！凡此过往，皆为序章。别回头，一起向阳而生！,[],['肖战发长文'],肖战发长文以后会跟你一起继续律己，会过好自己的生活。继续保持理智和纯粹好好努力，成更好的自己！凡此过往，皆为序章。别回头，一起向阳而生！
134,早安朋友圈背景图|简约风壁纸[组图共9张]原图,10,0,1,"<re.Match object; span=(14, 23), match='[组图共9张]原图'>",[],早安朋友圈背景图|简约风壁纸,[],[],早安朋友圈背景图|简约风壁纸
136,今天真的学到了好多新东西！除了谢谢还有一句真心的对不起。原图,2,0,0,"<re.Match object; span=(28, 30), match='原图'>",[],今天真的学到了好多新东西！除了谢谢还有一句真心的对不起。,[],[],今天真的学到了好多新东西！除了谢谢还有一句真心的对不起。
