,微博正文,点赞数,转发数,评论数,附图,附链接,TAG,明星,清洗正文,正文
1,被虐到了还没睡的做一下[组图共2张]原图,106,22,81,"<re.Match object; span=(11, 20), match='[组图共2张]原图'>",[],[],[],被虐到了还没睡的做一下,被虐到了还没睡的做一下
3,宝子们，睡前签一下寻艺和明权这两天都有十三万，希望能保持住！向十四万冲冲冲晚安(｡･ω･｡)ﾉ♡[组图共3张]原图,82,11,36,"<re.Match object; span=(48, 57), match='[组图共3张]原图'>",[],[],[],宝子们，睡前签一下寻艺和明权这两天都有十三万，希望能保持住！向十四万冲冲冲晚安(｡･ω･｡)ﾉ♡,宝子们，睡前签一下寻艺和明权这两天都有十三万，希望能保持住！向十四万冲冲冲晚安(｡･ω･｡)ﾉ♡
5,肖战宝贝，永远开心，平安喜乐，顺顺利利@X玖少年团肖战DAYTOY原图,596,44,68,"<re.Match object; span=(33, 35), match='原图'>",[],[],['@X玖少年团肖战DAYTOY'],肖战宝贝，永远开心，平安喜乐，顺顺利利@X玖少年团肖战DAYTOY,肖战宝贝，永远开心，平安喜乐，顺顺利利@X玖少年团肖战DAYTOY
6,#肖战[超话]#我要闹了还没有十三万还有哪个爬爬没做的送花做了吗？送花链接http://t.cn/AiWNpRI1多多顶帖扩散让大家都看到！@X玖少年团肖战DAYTOY#肖战斗罗大陆#xz#肖战唐三#[组图共4张]原图,171,96,169,"<re.Match object; span=(100, 109), match='[组图共4张]原图'>",['http://t.cn/AiWNpRI1'],"['肖战[超话]', '肖战斗罗大陆', '肖战唐三']",['@X玖少年团肖战DAYTOY'],我要闹了还没有十三万还有哪个爬爬没做的送花做了吗？送花链接多多顶帖扩散让大家都看到！@X玖少年团肖战DAYTOYxz,我要闹了还没有十三万还有哪个爬爬没做的送花做了吗？送花链接多多顶帖扩散让大家都看到！@X玖少年团肖战DAYTOYxz
7,#肖战[超话]##斗罗大陆超长花絮#花絮里面的丸子头小唐三#肖战斗罗大陆#[组图共4张]原图,2338,338,245,"<re.Match object; span=(37, 46), match='[组图共4张]原图'>",[],"['肖战[超话]', '斗罗大陆超长花絮', '肖战斗罗大陆']",[],花絮里面的丸子头小唐三,花絮里面的丸子头小唐三
12,#肖战[超话]##肖战斗罗大陆#xz#肖战余生请多指教#宝贝们寻艺明权做了吗？今天十三万很难了哥哥绿洲点赞了吗？可以多种方式登陆点赞！送花做了吗？送花链接http://t.cn/AiWNpRI1多多顶帖扩散让大家都看到！@X玖少年团肖战DAYTOY[组图共7张]原图,235,124,153,"<re.Match object; span=(124, 133), match='[组图共7张]原图'>",['http://t.cn/AiWNpRI1'],"['肖战[超话]', '肖战斗罗大陆', '肖战余生请多指教']",['@X玖少年团肖战DAYTOY'],xz宝贝们寻艺明权做了吗？今天十三万很难了哥哥绿洲点赞了吗？可以多种方式登陆点赞！送花做了吗？送花链接多多顶帖扩散让大家都看到！@X玖少年团肖战DAYTOY,xz宝贝们寻艺明权做了吗？今天十三万很难了哥哥绿洲点赞了吗？可以多种方式登陆点赞！送花做了吗？送花链接多多顶帖扩散让大家都看到！@X玖少年团肖战DAYTOY
14,宝贝，天天开心，平安喜乐，顺顺利利@X玖少年团肖战DAYTOY原图,1085,91,111,"<re.Match object; span=(31, 33), match='原图'>",[],[],['@X玖少年团肖战DAYTOY'],宝贝，天天开心，平安喜乐，顺顺利利@X玖少年团肖战DAYTOY,宝贝，天天开心，平安喜乐，顺顺利利@X玖少年团肖战DAYTOY
17,#肖战[超话]#宝贝们寻艺明权速速做一下！今天没昨晚高了！！#肖战余生请多指教#xz#肖战斗罗大陆#@X玖少年团肖战DAYTOY[组图共4张]原图,360,135,197,"<re.Match object; span=(64, 73), match='[组图共4张]原图'>",[],"['肖战[超话]', '肖战余生请多指教', '肖战斗罗大陆']",['@X玖少年团肖战DAYTOY'],宝贝们寻艺明权速速做一下！今天没昨晚高了！！xz@X玖少年团肖战DAYTOY,宝贝们寻艺明权速速做一下！今天没昨晚高了！！xz@X玖少年团肖战DAYTOY
25,马桶大粉公开辱骂xz王八当看不见玫瑰大妈著名言论“快乐的时光开始了”王八当看不见小马桶诅咒xz死了王八却在没有任何一个蘸丝涉及人身攻击的前提下纠结时间线现在还有清醒的好果果吗？下图这样才是正确的逻辑吧怎么还好意思用这个来挂我啊我屏蔽了个关键词招谁惹谁了被网暴千转...全文原图,46305,5836,2193,"<re.Match object; span=(136, 138), match='原图'>",[],[],[],马桶大粉公开辱骂xz王八当看不见玫瑰大妈著名言论“快乐的时光开始了”王八当看不见小马桶诅咒xz死了王八却在没有任何一个蘸丝涉及人身攻击的前提下纠结时间线现在还有清醒的好果果吗？下图这样才是正确的逻辑吧怎么还好意思用这个来挂我啊我屏蔽了个关键词招谁惹谁了被网暴千转...全文,马桶大粉公开辱骂xz王八当看不见玫瑰大妈著名言论“快乐的时光开始了”王八当看不见小马桶诅咒xz死了王八却在没有任何一个蘸丝涉及人身攻击的前提下纠结时间线现在还有清醒的好果果吗？下图这样才是正确的逻辑吧怎么还好意思用这个来挂我啊我屏蔽了个关键词招谁惹谁了被网暴千转...全文
29,"近日家中小兔子走失，其兔长相俊秀，放松时嘴两边有肉嘟嘟，嚼东西会有饭窝窝，笑得太激烈左眼睛会比右眼小，害羞的时候耳朵会红,拥抱喜欢埋肩，不设防的时候会听到嘿嘿笑笑完还有呲溜声，左边唇下有一颗小痣，喜欢吃小面包。小兔叫肖战，见到他记得跟他说，我很想他，谢谢[组图共9张]原图",1268,94,221,"<re.Match object; span=(127, 136), match='[组图共9张]原图'>",[],[],[],"近日家中小兔子走失，其兔长相俊秀，放松时嘴两边有肉嘟嘟，嚼东西会有饭窝窝，笑得太激烈左眼睛会比右眼小，害羞的时候耳朵会红,拥抱喜欢埋肩，不设防的时候会听到嘿嘿笑笑完还有呲溜声，左边唇下有一颗小痣，喜欢吃小面包。小兔叫肖战，见到他记得跟他说，我很想他，谢谢","近日家中小兔子走失，其兔长相俊秀，放松时嘴两边有肉嘟嘟，嚼东西会有饭窝窝，笑得太激烈左眼睛会比右眼小，害羞的时候耳朵会红,拥抱喜欢埋肩，不设防的时候会听到嘿嘿笑笑完还有呲溜声，左边唇下有一颗小痣，喜欢吃小面包。小兔叫肖战，见到他记得跟他说，我很想他，谢谢"
32,#肖战[超话]##肖战余生请多指教#xz#肖战斗罗大陆#宝贝们，早上好，📣📣见扩见顶，不要忘记基础呀❗️❗️1.还有人没给哥哥绿洲点赞的吗？！可以多种方式登陆，都可以点！2.超话积分还有人不会做吗？每人每天都去#肖战最好的你[超话]#求兔拿满！存着等差距缩小时抛超话积分新虾指南：...全文[组图共9张]原图,336,220,217,"<re.Match object; span=(145, 154), match='[组图共9张]原图'>",[],"['肖战[超话]', '肖战余生请多指教', '肖战斗罗大陆', '肖战最好的你[超话]']",[],xz宝贝们，早上好，📣📣见扩见顶，不要忘记基础呀❗️❗️1.还有人没给哥哥绿洲点赞的吗？！可以多种方式登陆，都可以点！2.超话积分还有人不会做吗？每人每天都去求兔拿满！存着等差距缩小时抛超话积分新虾指南：...全文,xz宝贝们，早上好，📣📣见扩见顶，不要忘记基础呀❗️❗️1.还有人没给哥哥绿洲点赞的吗？！可以多种方式登陆，都可以点！2.超话积分还有人不会做吗？每人每天都去求兔拿满！存着等差距缩小时抛超话积分新虾指南：...全文
33,#肖战最好的你[超话]#今日份求兔互兔！！早上起来给兔子先生攒🐔分啦！！加油加油，攒着别抛，留着周一抛！#肖战余生请多指教#xz#肖战顾魏#@X玖少年团肖战DAYTOY原图,792,78,2010,"<re.Match object; span=(84, 86), match='原图'>",[],"['肖战最好的你[超话]', '肖战余生请多指教', '肖战顾魏']",['@X玖少年团肖战DAYTOY'],今日份求兔互兔！！早上起来给兔子先生攒🐔分啦！！加油加油，攒着别抛，留着周一抛！xz@X玖少年团肖战DAYTOY,今日份求兔互兔！！早上起来给兔子先生攒🐔分啦！！加油加油，攒着别抛，留着周一抛！xz@X玖少年团肖战DAYTOY
35,睡前可以签一下，晚安[组图共2张]原图,318,5,39,"<re.Match object; span=(10, 19), match='[组图共2张]原图'>",[],[],[],睡前可以签一下，晚安,睡前可以签一下，晚安
38,#肖战最好的你[超话]#大家今日🐔分都拿满了吗？没满的抓紧时间啦！超话差距已经超一千万了，大家暂时别抛，攒着下礼拜周一一过零点就抛哈#肖战余生请多指教#xz#肖战顾魏#原图,636,132,319,"<re.Match object; span=(84, 86), match='原图'>",[],"['肖战最好的你[超话]', '肖战余生请多指教', '肖战顾魏']",[],大家今日🐔分都拿满了吗？没满的抓紧时间啦！超话差距已经超一千万了，大家暂时别抛，攒着下礼拜周一一过零点就抛哈xz,大家今日🐔分都拿满了吗？没满的抓紧时间啦！超话差距已经超一千万了，大家暂时别抛，攒着下礼拜周一一过零点就抛哈xz
39,好真实啊，又好厉害原图,2577,290,205,"<re.Match object; span=(9, 11), match='原图'>",[],[],[],好真实啊，又好厉害,好真实啊，又好厉害
40,小羊的快乐很简单还有谁没有做的吗[组图共2张]原图,445,67,147,"<re.Match object; span=(16, 25), match='[组图共2张]原图'>",[],[],[],小羊的快乐很简单还有谁没有做的吗,小羊的快乐很简单还有谁没有做的吗
42,#肖战[超话]##肖战余生请多指教#xz#肖战顾魏#宝贝们寻艺明权做了吗？今天十三万冲冲冲哥哥绿洲点赞了吗？可以多种方式登陆点赞！送花做了吗？送花链接http://t.cn/AiWNpRI1多多顶帖扩散让大家都看到！@X玖少年团肖战DAYTOY[组图共6张]原图,193,83,140,"<re.Match object; span=(122, 131), match='[组图共6张]原图'>",['http://t.cn/AiWNpRI1'],"['肖战[超话]', '肖战余生请多指教', '肖战顾魏']",['@X玖少年团肖战DAYTOY'],xz宝贝们寻艺明权做了吗？今天十三万冲冲冲哥哥绿洲点赞了吗？可以多种方式登陆点赞！送花做了吗？送花链接多多顶帖扩散让大家都看到！@X玖少年团肖战DAYTOY,xz宝贝们寻艺明权做了吗？今天十三万冲冲冲哥哥绿洲点赞了吗？可以多种方式登陆点赞！送花做了吗？送花链接多多顶帖扩散让大家都看到！@X玖少年团肖战DAYTOY
44,#肖战[超话]##出场必出彩#那必然得有冰球战一席之地了！！博观而约取，厚积而薄发。演员肖战@X玖少年团肖战DAYTOY，砥砺前行。漫漫星光路，殷殷至诚心。#肖战余生请多指教#[组图共9张]原图,316758,25824,35586,"<re.Match object; span=(88, 97), match='[组图共9张]原图'>",[],"['肖战[超话]', '出场必出彩', '肖战余生请多指教']",['@X玖少年团肖战DAYTOY'],那必然得有冰球战一席之地了！！博观而约取，厚积而薄发。演员肖战@X玖少年团肖战DAYTOY，砥砺前行。漫漫星光路，殷殷至诚心。,那必然得有冰球战一席之地了！！博观而约取，厚积而薄发。演员肖战@X玖少年团肖战DAYTOY，砥砺前行。漫漫星光路，殷殷至诚心。
51,#肖战[超话]#六点半啦！宝贝们寻艺明权做了吗？送花做了吗？送花链接http://t.cn/AiWNpRI1多多顶帖扩散让大家都看到！#肖战余生请多指教#xz#肖战顾魏#@X玖少年团肖战DAYTOY[组图共4张]原图,266,263,240,"<re.Match object; span=(99, 108), match='[组图共4张]原图'>",['http://t.cn/AiWNpRI1'],"['肖战[超话]', '肖战余生请多指教', '肖战顾魏']",['@X玖少年团肖战DAYTOY'],六点半啦！宝贝们寻艺明权做了吗？送花做了吗？送花链接多多顶帖扩散让大家都看到！xz@X玖少年团肖战DAYTOY,六点半啦！宝贝们寻艺明权做了吗？送花做了吗？送花链接多多顶帖扩散让大家都看到！xz@X玖少年团肖战DAYTOY
56,#肖战[超话]#哥哥在绿洲跟我们交心但是这点赞太少了大家来团建一下绿洲点赞，可以【多种方式登陆】。青少年模式也可以再点一次赞别忘了绿洲很重要哈！！#肖战斗罗大陆#xz#肖战唐三#[组图共3张]原图,1546,393,389,"<re.Match object; span=(89, 98), match='[组图共3张]原图'>",[],"['肖战[超话]', '肖战斗罗大陆', '肖战唐三']",[],哥哥在绿洲跟我们交心但是这点赞太少了大家来团建一下绿洲点赞，可以【多种方式登陆】。青少年模式也可以再点一次赞别忘了绿洲很重要哈！！xz,哥哥在绿洲跟我们交心但是这点赞太少了大家来团建一下绿洲点赞，可以【多种方式登陆】。青少年模式也可以再点一次赞别忘了绿洲很重要哈！！xz
59,永远爱你是我说过@X玖少年团肖战DAYTOY原图,1139,63,74,"<re.Match object; span=(22, 24), match='原图'>",[],[],['@X玖少年团肖战DAYTOY'],永远爱你是我说过@X玖少年团肖战DAYTOY,永远爱你是我说过@X玖少年团肖战DAYTOY
60,#肖战[超话]#不要光哭唧唧，用行动来证明寻艺明权做一下，送花做一下送花链接http://t.cn/AiWNpRI1完成打卡转发扩散！！#肖战斗罗大陆#xz#肖战唐三#@X玖少年团肖战DAYTOY[组图共4张]原图,470,287,315,"<re.Match object; span=(98, 107), match='[组图共4张]原图'>",['http://t.cn/AiWNpRI1'],"['肖战[超话]', '肖战斗罗大陆', '肖战唐三']",['@X玖少年团肖战DAYTOY'],不要光哭唧唧，用行动来证明寻艺明权做一下，送花做一下送花链接完成打卡转发扩散！！xz@X玖少年团肖战DAYTOY,不要光哭唧唧，用行动来证明寻艺明权做一下，送花做一下送花链接完成打卡转发扩散！！xz@X玖少年团肖战DAYTOY
64,“无助，迷茫，沮丧”要不是看到这些词，我都差点要忘了，那段时间他经历了什么打官司，半雪藏，被取消的活动，其实又比去年好到哪里去呢，好在都过来了，我哥哥真的很厉害…#肖战的零散随记#原图,11856,2872,841,"<re.Match object; span=(90, 92), match='原图'>",[],['肖战的零散随记'],[],“无助，迷茫，沮丧”要不是看到这些词，我都差点要忘了，那段时间他经历了什么打官司，半雪藏，被取消的活动，其实又比去年好到哪里去呢，好在都过来了，我哥哥真的很厉害…,“无助，迷茫，沮丧”要不是看到这些词，我都差点要忘了，那段时间他经历了什么打官司，半雪藏，被取消的活动，其实又比去年好到哪里去呢，好在都过来了，我哥哥真的很厉害…
67,哥哥，你为什么这么好啊#肖战的零散随记#[组图共4张]原图,1951,190,137,"<re.Match object; span=(20, 29), match='[组图共4张]原图'>",[],['肖战的零散随记'],[],哥哥，你为什么这么好啊,哥哥，你为什么这么好啊
68,哥哥！分享@X玖少年团肖战DAYTOY的@绿洲动态:📝绿洲原图,376,21,18,"<re.Match object; span=(29, 31), match='原图'>",[],[],['@X玖少年团肖战DAYTOY'],哥哥！分享@X玖少年团肖战DAYTOY的@绿洲动态:📝绿洲,哥哥！分享@X玖少年团肖战DAYTOY的@绿洲动态:📝绿洲
70,#肖战[超话]#最后半个小时？还有谁没做的吗？🆘十三万可以吗[可怜]转发打卡扩散！！#肖战余生请多指教#xz#肖战顾魏#@X玖少年团肖战DAYTOY[组图共2张]原图,231,180,226,"<re.Match object; span=(74, 83), match='[组图共2张]原图'>",[],"['肖战[超话]', '肖战余生请多指教', '肖战顾魏']",['@X玖少年团肖战DAYTOY'],最后半个小时？还有谁没做的吗？🆘十三万可以吗[可怜]转发打卡扩散！！xz@X玖少年团肖战DAYTOY,最后半个小时？还有谁没做的吗？🆘十三万可以吗[可怜]转发打卡扩散！！xz@X玖少年团肖战DAYTOY
72,#肖战[超话]##肖战余生请多指教#所有虾虾们🆘花十秒做一下寻权再花十秒送三朵小花花给大帅哥送花链接http://t.cn/AiWNpRI1完成打卡转发扩散！！@X玖少年团肖战DAYTOY#肖战顾魏#[组图共4张]原图,283,206,247,"<re.Match object; span=(100, 109), match='[组图共4张]原图'>",['http://t.cn/AiWNpRI1'],"['肖战[超话]', '肖战余生请多指教', '肖战顾魏']",['@X玖少年团肖战DAYTOY'],所有虾虾们🆘花十秒做一下寻权再花十秒送三朵小花花给大帅哥送花链接完成打卡转发扩散！！@X玖少年团肖战DAYTOY,所有虾虾们🆘花十秒做一下寻权再花十秒送三朵小花花给大帅哥送花链接完成打卡转发扩散！！@X玖少年团肖战DAYTOY
73,额，v榜👸🏻号的文章虽然在给某公司吹逼，不过也从另一维度说明了斗罗的成绩[组图共5张]原图,7812,896,562,"<re.Match object; span=(36, 45), match='[组图共5张]原图'>",[],[],[],额，v榜👸🏻号的文章虽然在给某公司吹逼，不过也从另一维度说明了斗罗的成绩,额，v榜👸🏻号的文章虽然在给某公司吹逼，不过也从另一维度说明了斗罗的成绩
75,http://t.cn/A6tun7f7还差一点点评论，都来跟哥哥聊天，内赞点满原图,203,18,70,"<re.Match object; span=(40, 42), match='原图'>",['http://t.cn/A6tun7f7'],[],[],还差一点点评论，都来跟哥哥聊天，内赞点满,还差一点点评论，都来跟哥哥聊天，内赞点满
77,“永远不要轻易放弃，然后从内到外变得更强，去创造属于你自己的世界。”——《斗罗大陆》[组图共2张]原图,2414,523,272,"<re.Match object; span=(42, 51), match='[组图共2张]原图'>",[],[],[],“永远不要轻易放弃，然后从内到外变得更强，去创造属于你自己的世界。”——《斗罗大陆》,“永远不要轻易放弃，然后从内到外变得更强，去创造属于你自己的世界。”——《斗罗大陆》
78,#肖战最好的你[超话]#大家今日份🐔分拿满了吗？没满的快求兔！满了的有时间来这里给别人兔兔哦给兔子先生攒🐔分[抱一抱]#肖战斗罗大陆#xz#肖战唐三#原图,203,33,318,"<re.Match object; span=(75, 77), match='原图'>",[],"['肖战最好的你[超话]', '肖战斗罗大陆', '肖战唐三']",[],大家今日份🐔分拿满了吗？没满的快求兔！满了的有时间来这里给别人兔兔哦给兔子先生攒🐔分[抱一抱]xz,大家今日份🐔分拿满了吗？没满的快求兔！满了的有时间来这里给别人兔兔哦给兔子先生攒🐔分[抱一抱]xz
81,#肖战[超话]#http://t.cn/A6tun7f7所有人，来团建一下哥哥微博内外赞！！三哥收官难道不值得一个六百万？楼中楼也可以，十分钟之内有30个有效赞，有效赞没了再等十分钟就可以继续点，或者换别的hao。#肖战斗罗大陆#xz#肖战唐三#[组图共2张]原图,1010,721,516,"<re.Match object; span=(123, 132), match='[组图共2张]原图'>",['http://t.cn/A6tun7f7'],"['肖战[超话]', '肖战斗罗大陆', '肖战唐三']",[],所有人，来团建一下哥哥微博内外赞！！三哥收官难道不值得一个六百万？楼中楼也可以，十分钟之内有30个有效赞，有效赞没了再等十分钟就可以继续点，或者换别的hao。xz,所有人，来团建一下哥哥微博内外赞！！三哥收官难道不值得一个六百万？楼中楼也可以，十分钟之内有30个有效赞，有效赞没了再等十分钟就可以继续点，或者换别的hao。xz
84,#肖战[超话]##肖战余生请多指教#xz#肖战顾魏#宝贝们，晚上好，📣📣见扩见顶，不要忘记基础呀❗️❗️1.https://m.weibo.cn/1792951112/4615357887938988哥哥微博转赞评，内赞点满！！楼中楼也算！~2.超话积分还有人不会做吗？每人每天都去#肖战最好的你[超话]#求兔拿满！存着等差距缩小时抛超话积分新虾指南：http://t.cn/A6tj8gZI3.花十秒做一下寻权4.再花十秒送三朵小花花给大帅哥送花链接http://t.cn/AiWNpRI1非常非常简单，不要拖，很多人想拖到晚做最后就忘记啦5.做完了继续追剧继续炖鹅[牛牛哒][组图共9张]原图,339,378,220,"<re.Match object; span=(289, 298), match='[组图共9张]原图'>","['http://t.cn/A6tj8gZI3.', 'http://t.cn/AiWNpRI1']","['肖战[超话]', '肖战余生请多指教', '肖战顾魏', '肖战最好的你[超话]']",[],xz宝贝们，晚上好，📣📣见扩见顶，不要忘记基础呀❗️❗️1.https://m.weibo.cn/1792951112/4615357887938988哥哥微博转赞评，内赞点满！！楼中楼也算！~2.超话积分还有人不会做吗？每人每天都去求兔拿满！存着等差距缩小时抛超话积分新虾指南：花十秒做一下寻权4.再花十秒送三朵小花花给大帅哥送花链接非常非常简单，不要拖，很多人想拖到晚做最后就忘记啦5.做完了继续追剧继续炖鹅[牛牛哒],xz宝贝们，晚上好，📣📣见扩见顶，不要忘记基础呀❗️❗️1.https://m.weibo.cn/1792951112/4615357887938988哥哥微博转赞评，内赞点满！！楼中楼也算！~2.超话积分还有人不会做吗？每人每天都去求兔拿满！存着等差距缩小时抛超话积分新虾指南：花十秒做一下寻权4.再花十秒送三朵小花花给大帅哥送花链接非常非常简单，不要拖，很多人想拖到晚做最后就忘记啦5.做完了继续追剧继续炖鹅[牛牛哒]
92,#肖战[超话]##肖战告别斗罗大陆#论肖战的仪式感演过诸多别样人生的他想要哪种啊#斗罗大陆全员收官自拍#[组图共9张]原图,2734,541,252,"<re.Match object; span=(52, 61), match='[组图共9张]原图'>",[],"['肖战[超话]', '肖战告别斗罗大陆', '斗罗大陆全员收官自拍']",[],论肖战的仪式感演过诸多别样人生的他想要哪种啊,论肖战的仪式感演过诸多别样人生的他想要哪种啊
94,#肖战[超话]#热搜在榜，多发原创加热哈！！给三哥排面！！#肖战斗罗大陆#xz#肖战唐三#原图,289,29,47,"<re.Match object; span=(45, 47), match='原图'>",[],"['肖战[超话]', '肖战斗罗大陆', '肖战唐三']",[],热搜在榜，多发原创加热哈！！给三哥排面！！xz,热搜在榜，多发原创加热哈！！给三哥排面！！xz
102,肖战真是个很好很好很好的人[组图共2张]原图,4544,1465,471,"<re.Match object; span=(13, 22), match='[组图共2张]原图'>",[],[],[],肖战真是个很好很好很好的人,肖战真是个很好很好很好的人
106,工作室痘印！！和你相遇，也是我最大的幸运#肖战斗罗大陆#原图,450,43,31,"<re.Match object; span=(28, 30), match='原图'>",[],['肖战斗罗大陆'],[],工作室痘印！！和你相遇，也是我最大的幸运,工作室痘印！！和你相遇，也是我最大的幸运
107,http://t.cn/A6tuYIjn来点点言之有物的唯粉[组图共2张]原图,110,28,31,"<re.Match object; span=(30, 39), match='[组图共2张]原图'>",['http://t.cn/A6tuYIjn'],[],[],来点点言之有物的唯粉,来点点言之有物的唯粉
112,19年7月的哥哥#斗罗大陆全员收官自拍#原图,1133,252,140,"<re.Match object; span=(20, 22), match='原图'>",[],['斗罗大陆全员收官自拍'],[],19年7月的哥哥,19年7月的哥哥
115,#肖战[超话]##肖战斗罗大陆#xz#肖战唐三#宝贝们，早上好，📣📣见扩见顶，不要忘记基础呀❗️❗️1.寻艺明权现在很丝滑，快去！！！2.超话积分还有人不会做吗？每人每天都去#肖战最好的你[超话]#求兔拿满！存着等差距缩小时抛超话积分新虾指南：http://t.cn/A6tj8gZI3.再花十秒送三朵小花花给大帅哥送花链接http://t.cn/AiWNpRI1非常非常简单，不要拖，很多人想拖到晚做最后就忘记啦4.做完了继续追剧继续炖鹅[牛牛哒]@X玖少年团肖战DAYTOY[组图共6张]原图,185,203,153,"<re.Match object; span=(239, 248), match='[组图共6张]原图'>","['http://t.cn/A6tj8gZI3.', 'http://t.cn/AiWNpRI1']","['肖战[超话]', '肖战斗罗大陆', '肖战唐三', '肖战最好的你[超话]']",['@X玖少年团肖战DAYTOY'],xz宝贝们，早上好，📣📣见扩见顶，不要忘记基础呀❗️❗️1.寻艺明权现在很丝滑，快去！！！2.超话积分还有人不会做吗？每人每天都去求兔拿满！存着等差距缩小时抛超话积分新虾指南：再花十秒送三朵小花花给大帅哥送花链接非常非常简单，不要拖，很多人想拖到晚做最后就忘记啦4.做完了继续追剧继续炖鹅[牛牛哒]@X玖少年团肖战DAYTOY,xz宝贝们，早上好，📣📣见扩见顶，不要忘记基础呀❗️❗️1.寻艺明权现在很丝滑，快去！！！2.超话积分还有人不会做吗？每人每天都去求兔拿满！存着等差距缩小时抛超话积分新虾指南：再花十秒送三朵小花花给大帅哥送花链接非常非常简单，不要拖，很多人想拖到晚做最后就忘记啦4.做完了继续追剧继续炖鹅[牛牛哒]@X玖少年团肖战DAYTOY
